,Review_Text,Review_Clean_List,Review_Clean
489,Benteng dengan bentuk Kura -kura peninggalan jaman Belanda yang menghadap langsung ke laut. Banyak penginggalan sejarah di dalam benteng Roterdam. Dan ada penjara bekas pembuangan Pangeran Diponegoro.,"['benteng', 'bentuk', 'kura', 'kura', 'tinggal', 'jaman', 'belanda', 'hadap', 'langsung', 'laut', 'penginggalan', 'sejarah', 'benteng', 'roterdam', 'penjara', 'bekas', 'buang', 'pangeran', 'diponegoro']",benteng bentuk kura kura tinggal jaman belanda hadap langsung laut penginggalan sejarah benteng roterdam penjara bekas buang pangeran diponegoro
490,"Benteng Rotterdam di kota Makassar ini merupakan salah satu sisa peninggalan kolonialisme di Makassar, mengingatkan bahwa pada zaman itu, pejuang kita memberikan perlawanan yang sengit terhadap penjajahan Belanda. Kondisi benteng masih cukup baik, meski agak kurang terawat. Selain itu terdapat 2 museum yang berisikan benda-benda bersejarah. Cukup menarik meski belum dapat disandingkan dengan museum di luar negeri, tapi upaya ini perlu diapresiasi dan didukung oleh masyarakat. D luar benteng, terdapat huruf-huruf besar yang membentuk kata Rotterdam (yang mengingatkan pada I am sterdam) yang sering dipakai sebagai latar berfoto ria oleh para abg :)","['benteng', 'rotterdam', 'kota', 'makassar', 'rupa', 'salah', 'sisa', 'tinggal', 'kolonialisme', 'makassar', 'zaman', 'juang', 'lawan', 'sengit', 'hadap', 'jajah', 'belanda', 'kondisi', 'benteng', 'awat', 'museum', 'risi', 'benda', 'benda', 'sejarah', 'tarik', 'sanding', 'museum', 'negeri', 'upaya', 'apresiasi', 'dukung', 'masyarakat', 'd', 'benteng', 'huruf', 'huruf', 'bentuk', 'rotterdam', 'i', 'am', 'sterdam', 'pakai', 'latar', 'foto', 'ria', 'abg']",benteng rotterdam kota makassar rupa salah sisa tinggal kolonialisme makassar zaman juang lawan sengit hadap jajah belanda kondisi benteng awat museum risi benda benda sejarah tarik sanding museum negeri upaya apresiasi dukung masyarakat d benteng huruf huruf bentuk rotterdam i am sterdam pakai latar foto ria abg
491,"Seperti kebanyakan museum di Indonesia, bangunan tua peninggalan sejarah seperti ini tidak terlalu menarik. Bentengnya yang tua bisa dikelilingi dalam waktu 30 menit saja, itupun sudah termasuk foto-foto.Seharusnya pemkot setempat lebih banyak mengadakan event kreatif yang ""menjual"", misalnya wisata malam seperti di museum kota tua jakarta. Sayang sekali, padahal di luar sana, museum dan bangunan-bangunan tua selalu menarik minat wisata.","['museum', 'indonesia', 'bangun', 'tua', 'tinggal', 'sejarah', 'tarik', 'benteng', 'tua', 'keliling', 'menit', 'masuk', 'foto', 'foto', 'pemkot', 'event', 'kreatif', 'jual', 'wisata', 'malam', 'museum', 'kota', 'tua', 'jakarta', 'sayang', 'museum', 'bangun', 'bangun', 'tua', 'tarik', 'minat', 'wisata']",museum indonesia bangun tua tinggal sejarah tarik benteng tua keliling menit masuk foto foto pemkot event kreatif jual wisata malam museum kota tua jakarta sayang museum bangun bangun tua tarik minat wisata
492,"Situs ini merupakan benteng dan pusat pemerintahan kolonial Belanda. Hingga kini, tempat ini masih terpelihara. Yang menyenangkan adalah bahwa tempat ini dimanfaatkan secara optimal sebagai museum budaya Makassar, dengan visual yang menarik dan suasana yang nyaman. Full AC.","['situs', 'rupa', 'benteng', 'pusat', 'perintah', 'kolonial', 'belanda', 'pelihara', 'senang', 'manfaat', 'optimal', 'museum', 'budaya', 'makassar', 'visual', 'tarik', 'suasana', 'nyaman', 'full', 'ac']",situs rupa benteng pusat perintah kolonial belanda pelihara senang manfaat optimal museum budaya makassar visual tarik suasana nyaman full ac
493,"Ya, disini kita bisa melihat sejarah massa lalu.Beberapa kesan yang terlihat adalah Bangunan dan Fasilitas Kurang Terawat. Terdapat Sampah di beberapa tempat. Serta tidak adanya petugas / pegawai / pemandu yang siap.begitu masuk pintu gerbang, kita akan mengisi buku kunjungan, Disini kita ditawarkan memberikan biaya seihlasnya. tidak ada karcis retribusi ke sini. Cukup aneh, kemana uang nya?(dan saya tidak yakin digunakan untuk biaya pemeliharaan)benteng ini dikelola oleh Kementerian Pendidikan dan Kebudayaan (pemerintah pusat).pengelolaan oleh PNS ini menghaslkan kesan ala kadarnya.Ada baiknya swasta / pemerintah daerah bisa berperan lebih banyak agar benteng lebih baik.terdapat musemum La galigo di gedung sebelah kanan dan kiri. disini kita membayar retribusi RP5000. dalam museum ini diceritakan perkembangan peradaban makassar. mulai dari zaman purba sampai sekarang. sangat membantu bagi siswa sekolah atau siapapun yang tertarik dengan budaya dan sejarah. Disini juga terdapat gedung dimana Pangeran Diponegoro dipenjarakan. sayang ruang ini tidak dibuka untuk umum. dan beberapa gedung di dalam kompleks tidak diketahui fungsinya (mungkin buat kantor).","['ya', 'lihat', 'sejarah', 'massa', 'kesan', 'lihat', 'bangun', 'fasilitas', 'awat', 'sampah', 'tugas', 'pegawai', 'pandu', 'masuk', 'pintu', 'gerbang', 'isi', 'buku', 'kunjung', 'tawar', 'biaya', 'seihlasnya', 'karcis', 'retribusi', 'aneh', 'uang', 'nya', 'biaya', 'pelihara', 'benteng', 'kelola', 'menteri', 'didik', 'budaya', 'perintah', 'pusat', 'kelola', 'pns', 'menghaslkan', 'kesan', 'ala', 'kadar', 'swasta', 'perintah', 'daerah', 'peran', 'benteng', 'musemum', 'la', 'galigo', 'gedung', 'belah', 'kanan', 'kiri', 'bayar', 'retribusi', 'rp', 'museum', 'cerita', 'kembang', 'adab', 'makassar', 'zaman', 'purba', 'bantu', 'siswa', 'sekolah', 'tarik', 'budaya', 'sejarah', 'gedung', 'pangeran', 'diponegoro', 'penjara', 'sayang', 'ruang', 'buka', 'gedung', 'kompleks', 'fungsi', 'kantor']",ya lihat sejarah massa kesan lihat bangun fasilitas awat sampah tugas pegawai pandu masuk pintu gerbang isi buku kunjung tawar biaya seihlasnya karcis retribusi aneh uang nya biaya pelihara benteng kelola menteri didik budaya perintah pusat kelola pns menghaslkan kesan ala kadar swasta perintah daerah peran benteng musemum la galigo gedung belah kanan kiri bayar retribusi rp museum cerita kembang adab makassar zaman purba bantu siswa sekolah tarik budaya sejarah gedung pangeran diponegoro penjara sayang ruang buka gedung kompleks fungsi kantor
494,"Lokasinya sangat teramat strategis, ke kiri hanya beberapa puluh meter sudah sampai di pusat kota, ke kanan sepanjang jalan sudah langsung berhadapan dengan anjungan pantai Losari. Kondisi benteng peninggalan kerajaan Gowa ini masih terawat sangat bersih, dan tentu saja masuk ke area sini GRATIS, namun disayangkan ada praktek ""uang suka rela"" sama petugas-nya pas kita isi buku tamu. kalau akhir pekan banyak komunitas anak muda berkumpul disini sambil ngabuburit (pas itu saya bulan puasa perginya), masuk ke museumnya hanya Rp 10.000 saja. pergilah pas sore-sore dan duduk di atas bentengnya sambil melempar pandangan ke arah pantai dengan pemandangan senja di ufuk barat, momen yang tidak bisa tergantikan melihat matahari terbenam disini.dan sayangnya kebersihan di dalam kompleks benteng tidak dibarengi kebersihan di luar benteng yan isi-nya banyak penjual kaki lima yang berjejeran yang mengoyak pandangan rapi.","['lokasi', 'strategis', 'kiri', 'puluh', 'meter', 'pusat', 'kota', 'kanan', 'jalan', 'langsung', 'hadap', 'anjung', 'pantai', 'losari', 'kondisi', 'benteng', 'tinggal', 'raja', 'gowa', 'awat', 'bersih', 'masuk', 'area', 'gratis', 'sayang', 'praktek', 'uang', 'suka', 'rela', 'tugas', 'nya', 'pas', 'isi', 'buku', 'tamu', 'pekan', 'komunitas', 'anak', 'muda', 'kumpul', 'ngabuburit', 'pas', 'puasa', 'pergi', 'masuk', 'museum', 'rp', 'pergi', 'pas', 'sore', 'sore', 'duduk', 'benteng', 'lempar', 'pandang', 'arah', 'pantai', 'pandang', 'senja', 'ufuk', 'barat', 'momen', 'ganti', 'lihat', 'matahari', 'benam', 'sayang', 'bersih', 'kompleks', 'benteng', 'bareng', 'bersih', 'benteng', 'yan', 'isi', 'nya', 'jual', 'kaki', 'jejer', 'oyak', 'pandang', 'rapi']",lokasi strategis kiri puluh meter pusat kota kanan jalan langsung hadap anjung pantai losari kondisi benteng tinggal raja gowa awat bersih masuk area gratis sayang praktek uang suka rela tugas nya pas isi buku tamu pekan komunitas anak muda kumpul ngabuburit pas puasa pergi masuk museum rp pergi pas sore sore duduk benteng lempar pandang arah pantai pandang senja ufuk barat momen ganti lihat matahari benam sayang bersih kompleks benteng bareng bersih benteng yan isi nya jual kaki jejer oyak pandang rapi
495,"Fort Rotterdam merupakan peninggalan Belanda yang dibangun di abad 16an. Merupakan salah satu simbol kota Makassar. Fort ini masih sangat terawat dan dipelihara kebersihannya. Di Fort ini juga ada pemutaran film mengenai sejarah Fort Rotterdam. Sayangnya, belum ada kemasan program wisata yang menarik untuk tempat ini sehingga pengunjung cenderung hanya masuk sebentar untuk berfoto-foto lalu pulang. Lokasinya dekat dan sejalan dengan Pantai Losari.","['fort', 'rotterdam', 'rupa', 'tinggal', 'belanda', 'bangun', 'abad', 'an', 'rupa', 'salah', 'simbol', 'kota', 'makassar', 'fort', 'awat', 'pelihara', 'bersih', 'fort', 'putar', 'film', 'kena', 'sejarah', 'fort', 'rotterdam', 'sayang', 'kemas', 'program', 'wisata', 'tarik', 'unjung', 'cenderung', 'masuk', 'sebentar', 'foto', 'foto', 'pulang', 'lokasi', 'jalan', 'pantai', 'losari']",fort rotterdam rupa tinggal belanda bangun abad an rupa salah simbol kota makassar fort awat pelihara bersih fort putar film kena sejarah fort rotterdam sayang kemas program wisata tarik unjung cenderung masuk sebentar foto foto pulang lokasi jalan pantai losari
496,"Untuk hunting  pengambilan photo, sebaiknya datang pada pagi hari dan antara Senin - Jum'at.   Sayangnya jarak logo Fort Rotterdam yang dibangun diluar benteng terlampau dekat dengan jalan raya dan spotnya terganggu dengan adanya tiang listrik/lampu.","['hunting', 'ambil', 'photo', 'pagi', 'senin', 'jum', 'at', 'sayang', 'jarak', 'logo', 'fort', 'rotterdam', 'bangun', 'benteng', 'lampau', 'jalan', 'raya', 'spotnya', 'ganggu', 'tiang', 'listrik', 'lampu']",hunting ambil photo pagi senin jum at sayang jarak logo fort rotterdam bangun benteng lampau jalan raya spotnya ganggu tiang listrik lampu
497,"Pertama kali saya ke Makassar, tahun 2011 yang lalu saya sempatkan mampir ke Benteng Rotterdam. Benteng peninggalan masa penjajahan ini masih awet terawat dan menjadi objek wisata dan museum sejarah yang cukup apik. Benteng ini letaknya cukup strategis dan mudah dicapai karena letaknya di antara Pantai Losari dan pelabuhan ini, masih menyimpan berbagai peninggalan sejarah dari masa penjajahan dan masa kerajaan di Makassar.Yang unik dari benteng ini, adalah bangunannya yang khas. Kalau kita naik ke atas kita juga bisa melihat pemandangan dan mengambil foto dengan berbagai angle. Di sini juga ada penjual souvenir khas Makassar seperti aksesoris dan pernak-pernik dari batu yang harganya tidak terlalu mahal seperti gelang, kalung, dan sebagainya,Dan saya masih berkunjung ke benteng ini setiap kali saya berkunjung ke Makassar.","['kali', 'makassar', 'mampir', 'benteng', 'rotterdam', 'benteng', 'tinggal', 'jajah', 'awet', 'awat', 'objek', 'wisata', 'museum', 'sejarah', 'apik', 'benteng', 'letak', 'strategis', 'mudah', 'capai', 'letak', 'pantai', 'losari', 'labuh', 'simpan', 'tinggal', 'sejarah', 'jajah', 'raja', 'makassar', 'unik', 'benteng', 'bangun', 'khas', 'lihat', 'pandang', 'ambil', 'foto', 'angle', 'jual', 'souvenir', 'khas', 'makassar', 'aksesoris', 'pernak', 'pernik', 'batu', 'harga', 'mahal', 'gelang', 'kalung', 'kunjung', 'benteng', 'kali', 'kunjung', 'makassar']",kali makassar mampir benteng rotterdam benteng tinggal jajah awet awat objek wisata museum sejarah apik benteng letak strategis mudah capai letak pantai losari labuh simpan tinggal sejarah jajah raja makassar unik benteng bangun khas lihat pandang ambil foto angle jual souvenir khas makassar aksesoris pernak pernik batu harga mahal gelang kalung kunjung benteng kali kunjung makassar
498,"Benteng ini merupakan situs yang wajib dikunjungi jika singgah si makassar. Benteng peninggalan belanda itu sangat mudah dijangkau,karena letaknya di pusat kota. Hanya untuk mengambil foto atau mempelajari sejarahnya","['benteng', 'rupa', 'situs', 'wajib', 'kunjung', 'singgah', 'si', 'makassar', 'benteng', 'tinggal', 'belanda', 'mudah', 'jangkau', 'letak', 'pusat', 'kota', 'ambil', 'foto', 'ajar', 'sejarah']",benteng rupa situs wajib kunjung singgah si makassar benteng tinggal belanda mudah jangkau letak pusat kota ambil foto ajar sejarah
499,"Lokasi tidak jauh dari pantai losari, bahkan cukup ditempuh dengan jalan kaki. Benteng berdiri dengan kokohnya. Kebersihan tempat wisata terjaga. Tidak ada biaya masuk. Cukup dengan melapor ke petugas jaga.","['lokasi', 'pantai', 'losari', 'tempuh', 'jalan', 'kaki', 'benteng', 'kokoh', 'bersih', 'wisata', 'jaga', 'biaya', 'masuk', 'lapor', 'tugas', 'jaga']",lokasi pantai losari tempuh jalan kaki benteng kokoh bersih wisata jaga biaya masuk lapor tugas jaga
500,"saya sudah lama tidak ke benteng ini. mungkin terakhir kali belasan tahun lalu. rasanya kalau ke Makassar, gak sah kalo gak mampir. ini benteng peninggalan sejarah yang penting untuk kota Makassar. masuk ke benteng tidak bayar, hanya memberi donasi sekiranya dan mengisi buku tamu, adapun bila ingin masuk ke museum la galigo, kita harus membayar tiket 5 ribu rupiah. sangat murah.sayangnya benteng ini kurang terawat. di beberapa tembok tampak bekas coret-coretan anak muda yang pernah berkunjung. harusnya bisa di cat ulang agar lebih apik.selebihnya lingkungan benteng cukup bersih. tidak ada pedangan asongan berkeliaran. jadi untuk berkeliling dan menikmati pemandangan cukup nyaman.","['benteng', 'kali', 'bas', 'makassar', 'gak', 'sah', 'kalo', 'gak', 'mampir', 'benteng', 'tinggal', 'sejarah', 'kota', 'makassar', 'masuk', 'benteng', 'bayar', 'donasi', 'sekira', 'isi', 'buku', 'tamu', 'masuk', 'museum', 'la', 'galigo', 'bayar', 'tiket', 'ribu', 'rupiah', 'murah', 'sayang', 'benteng', 'awat', 'tembok', 'bekas', 'coret', 'coret', 'anak', 'muda', 'kunjung', 'cat', 'ulang', 'apik', 'lingkung', 'benteng', 'bersih', 'pedang', 'asong', 'liar', 'keliling', 'nikmat', 'pandang', 'nyaman']",benteng kali bas makassar gak sah kalo gak mampir benteng tinggal sejarah kota makassar masuk benteng bayar donasi sekira isi buku tamu masuk museum la galigo bayar tiket ribu rupiah murah sayang benteng awat tembok bekas coret coret anak muda kunjung cat ulang apik lingkung benteng bersih pedang asong liar keliling nikmat pandang nyaman
501,"Salah satu tempat yang patut dikunjungi jika ke Makassar. Namun sangat disayangkan banyak hal yang seharusnya bisa diperbaikiSeperti panggung yang mengganggu pemandangan di bagian tengah, seharusnya ditiadakanPemandu yang menarik dan resmi berbayar harus tersediaKelengkapan museum yang harus terus ditingkatkan jumlah dan perawatannyaToilet yang harus selalu tersedia dan kebersihan yang harus selalu dijaga","['salah', 'patut', 'kunjung', 'makassar', 'sayang', 'diperbaikiseperti', 'panggung', 'ganggu', 'pandang', 'ditiadakanpemandu', 'tarik', 'resmi', 'bayar', 'tersediakelengkapan', 'museum', 'tingkat', 'perawatannyatoilet', 'sedia', 'bersih', 'jaga']",salah patut kunjung makassar sayang diperbaikiseperti panggung ganggu pandang ditiadakanpemandu tarik resmi bayar tersediakelengkapan museum tingkat perawatannyatoilet sedia bersih jaga
502,"Anda bisa melihat kesejarahan nasional di lokasi ini, banyak peninggalan sejarah yang menjadi pembelajaran untuk lebih mengenal tentang makassar","['lihat', 'sejarah', 'nasional', 'lokasi', 'tinggal', 'sejarah', 'ajar', 'kenal', 'makassar']",lihat sejarah nasional lokasi tinggal sejarah ajar kenal makassar
503,"Bagi para pecinta sejarah, kurang afdol jika tidak berkunjung ke Benteng Fort Rotterdam saat ke Makassar. Tiket masuk gratis, hanya mengisi semacam buku tamu lalu kita dapat berkeliling ke kompleks benteng yang cukup luas. Di dalam kompleks terdapat beberapa bangunan, salah satunya adalah Museum La Galigo (tiket masuk terpisah).Bagian tempat yang saya sukai adalah ketika naik ke lapangan luas di bagian atas benteng. Sayangnya pemandangan yang didapat adalah gedung-gedung di sekitar area benteng.Sisi positif lain adalah tempat ini cukup bersih dan tidak ada pedagang yang berjualan di dalam area benteng.","['cinta', 'sejarah', 'afdol', 'kunjung', 'benteng', 'fort', 'rotterdam', 'makassar', 'tiket', 'masuk', 'gratis', 'isi', 'buku', 'tamu', 'keliling', 'kompleks', 'benteng', 'luas', 'kompleks', 'bangun', 'salah', 'museum', 'la', 'galigo', 'tiket', 'masuk', 'pisah', 'suka', 'lapang', 'luas', 'benteng', 'sayang', 'pandang', 'gedung', 'gedung', 'area', 'benteng', 'sisi', 'positif', 'bersih', 'dagang', 'jual', 'area', 'benteng']",cinta sejarah afdol kunjung benteng fort rotterdam makassar tiket masuk gratis isi buku tamu keliling kompleks benteng luas kompleks bangun salah museum la galigo tiket masuk pisah suka lapang luas benteng sayang pandang gedung gedung area benteng sisi positif bersih dagang jual area benteng
504,"Salah satu Benteng peninggalan zaman penjajahan Benlanda di Indonesia. Sudah lumayan terawat, tapi jadi kurang nyaman karena pedagang kali lima kurang teratur dan semraut.","['salah', 'benteng', 'tinggal', 'zaman', 'jajah', 'benlanda', 'indonesia', 'lumayan', 'awat', 'nyaman', 'dagang', 'kali', 'atur', 'semraut']",salah benteng tinggal zaman jajah benlanda indonesia lumayan awat nyaman dagang kali atur semraut
505,positif : kita dapat melihat bangunan dan sejarah makassar dan sulawesi di tempat ini..negatif : susah cari toilet..,"['positif', 'lihat', 'bangun', 'sejarah', 'makassar', 'sulawesi', 'negatif', 'susah', 'cari', 'toilet']",positif lihat bangun sejarah makassar sulawesi negatif susah cari toilet
506,"Kami pergi kesini dalam rangka mengisi waktu luang di jadwal dinas yang padat,benteng ini nampak kokoh dari luar dan banyak meninggalkan nilai sejarah, tiket masuk nya pun gratis tetapi di dalamnya nampaknya banyak yang sudah tidak diperhatikan dan butuh perbaikan. Coba saja untuk mengunjungi benteng ini bersama teman atau keluarga,biasanya di hari kerja sepi tetapi ramai diwaktu akhir pekan.","['pergi', 'kesini', 'rangka', 'isi', 'luang', 'jadwal', 'dinas', 'padat', 'benteng', 'nampak', 'kokoh', 'tinggal', 'nilai', 'sejarah', 'tiket', 'masuk', 'nya', 'gratis', 'nampaknya', 'perhati', 'butuh', 'coba', 'unjung', 'benteng', 'teman', 'keluarga', 'kerja', 'sepi', 'ramai', 'pekan']",pergi kesini rangka isi luang jadwal dinas padat benteng nampak kokoh tinggal nilai sejarah tiket masuk nya gratis nampaknya perhati butuh coba unjung benteng teman keluarga kerja sepi ramai pekan
507,"Fort Rotterdam menjadi tujuan utama kunjungan saya ke Makassar. Secara arsitektural, sangat bagus. Hanya ada beberapa kondisi ruang pamer yang nampak kurang terawat dan benda-benda yang tidak ada informasinya. Di dalam benteng ini juga terdapat Museum La Galigo. Kondisi secara umum penerangan gelap, informasi tidak jelas. Harus ditingkatkan.","['fort', 'rotterdam', 'tuju', 'utama', 'kunjung', 'makassar', 'arsitektural', 'bagus', 'kondisi', 'ruang', 'pamer', 'nampak', 'awat', 'benda', 'benda', 'informasi', 'benteng', 'museum', 'la', 'galigo', 'kondisi', 'terang', 'gelap', 'informasi', 'tingkat']",fort rotterdam tuju utama kunjung makassar arsitektural bagus kondisi ruang pamer nampak awat benda benda informasi benteng museum la galigo kondisi terang gelap informasi tingkat
508,"Seperti biasa bila kami mengunjungi suatu kota, tujuan wajib kami adalah mengunjungi wisata budaya dan sejarah di daerah yang kami kunjungi. Ketika kami mengunjungu Kota Makassar, Benteng Rotterdam adalah tujuan wisata yang wajib kami kunjungi.Benteng ini sangat menarik bagi saya dan keluarga, anak-anak saya sangat antusias mendengarkan penjelasan dari guide yang menjelaskan seluk beluk benteng beserta sejarah pendirian benteng dan sejarah kejayaan orang Sulawesi Selatan.Tiket masuk sebesar Rp. 5.000 tidak terlalu mahal dibanding pengalaman dan ilmu yang kami dapatkan, namun banyaknya pungutan yang tidak bertarif dengan dalih sukarela sangat mengecewakan kami, dan hanya di Benteng Rotterdam kami mengalami pungutan liar dan biaya guide yang sangat mahal.Masuk ke area Benteng Rotterdam, anda akan diarahkan ke ruang untuk mengisi buku tamu, disini anda akan diminta sumbangan sukarela, kami pikir tidak ada retribusi resmi untuk masuk, ternyata tidak, disalah satu bangunan ada meja yang meminta biaya untuk tiket masuk dengan lembaran tiket resmi sebesar Rp. 5.000, sangat memalukan. Keaetika kami meminta seorang guide dan menanyakan tarifnya kami diberikan informasi biaya serelanya, tetapi ternyata kami berikan jasa sebesar Rp. 100.000, sang guide meminta tambah Rp. 50.000 lagi, jadi total biaya guide kami Rp. 150.000, sangat mahal.","['unjung', 'kota', 'tuju', 'wajib', 'unjung', 'wisata', 'budaya', 'sejarah', 'daerah', 'kunjung', 'mengunjungu', 'kota', 'makassar', 'benteng', 'rotterdam', 'tuju', 'wisata', 'wajib', 'kunjung', 'benteng', 'tarik', 'keluarga', 'anak', 'anak', 'antusias', 'dengar', 'guide', 'seluk', 'beluk', 'benteng', 'sejarah', 'benteng', 'sejarah', 'jaya', 'orang', 'sulawesi', 'selatan', 'tiket', 'masuk', 'rp', 'mahal', 'banding', 'alam', 'ilmu', 'pungut', 'tarif', 'dalih', 'sukarela', 'kecewa', 'benteng', 'rotterdam', 'alami', 'pungut', 'liar', 'biaya', 'guide', 'mahal', 'masuk', 'area', 'benteng', 'rotterdam', 'arah', 'ruang', 'isi', 'buku', 'tamu', 'sumbang', 'sukarela', 'pikir', 'retribusi', 'resmi', 'masuk', 'nyata', 'salah', 'bangun', 'meja', 'biaya', 'tiket', 'masuk', 'lembar', 'tiket', 'resmi', 'rp', 'malu', 'keaetika', 'orang', 'guide', 'tarif', 'informasi', 'biaya', 'rela', 'nyata', 'ikan', 'jasa', 'rp', 'sang', 'guide', 'rp', 'total', 'biaya', 'guide', 'rp', 'mahal']",unjung kota tuju wajib unjung wisata budaya sejarah daerah kunjung mengunjungu kota makassar benteng rotterdam tuju wisata wajib kunjung benteng tarik keluarga anak anak antusias dengar guide seluk beluk benteng sejarah benteng sejarah jaya orang sulawesi selatan tiket masuk rp mahal banding alam ilmu pungut tarif dalih sukarela kecewa benteng rotterdam alami pungut liar biaya guide mahal masuk area benteng rotterdam arah ruang isi buku tamu sumbang sukarela pikir retribusi resmi masuk nyata salah bangun meja biaya tiket masuk lembar tiket resmi rp malu keaetika orang guide tarif informasi biaya rela nyata ikan jasa rp sang guide rp total biaya guide rp mahal
509,"Tempat bersejarah yg ada di makassar, cukup bersih, tapi panas sekali ketika siang hari meski berada di dekat pantai","['sejarah', 'yg', 'makassar', 'bersih', 'panas', 'siang', 'pantai']",sejarah yg makassar bersih panas siang pantai
510,"Saat kunnungan ke Makassar, saya menyempatkan diri sekalian mampir selepas dari Pantai Losari yang legendaris itu.benteng ini didirikan oleh Raja Gowa X di sekitar tahun 1500 an.Dulu bentng ini namanya benteng Panyua atau penyu. Jika dilihat dari atas, Nampak 4 kaki di setiap ujung benteng di kiri kanan depan belakang.saying, pada kejatuhan Raja Hasanuddin, benteng ini diberikan oleh pemerintah belanda yang lalu diubah namanya menjadi Fort Rotterdam.Memasuki benteng ini, di sisi kanan namp[ak patung Diponegoro. Apa hubungannya dengan Diponegoro-sosok pangeran dari Jawa? rupanya Pangeran Diponegoro dulu ditempatkan disini saat beliau dibuang oleh belanda hingga meninggalnya.benteng ini masih sangat terawatt. Di dal;amnya ada Museum La Galigo yang pantas untuk dilihat dan dipahami.","['kunnungan', 'makassar', 'mampir', 'lepas', 'pantai', 'losari', 'legendaris', 'benteng', 'raja', 'gowa', 'x', 'an', 'bentng', 'nama', 'benteng', 'panyua', 'penyu', 'lihat', 'nampak', 'kaki', 'ujung', 'benteng', 'kiri', 'kanan', 'saying', 'jatuh', 'raja', 'hasanuddin', 'benteng', 'perintah', 'belanda', 'ubah', 'nama', 'fort', 'rotterdam', 'pasuk', 'benteng', 'sisi', 'kanan', 'namp', 'ak', 'patung', 'diponegoro', 'hubung', 'diponegoro', 'sosok', 'pangeran', 'jawa', 'rupa', 'pangeran', 'diponegoro', 'beliau', 'buang', 'belanda', 'tinggal', 'benteng', 'terawatt', 'dal', 'amnya', 'museum', 'la', 'galigo', 'lihat', 'paham']",kunnungan makassar mampir lepas pantai losari legendaris benteng raja gowa x an bentng nama benteng panyua penyu lihat nampak kaki ujung benteng kiri kanan saying jatuh raja hasanuddin benteng perintah belanda ubah nama fort rotterdam pasuk benteng sisi kanan namp ak patung diponegoro hubung diponegoro sosok pangeran jawa rupa pangeran diponegoro beliau buang belanda tinggal benteng terawatt dal amnya museum la galigo lihat paham
511,"Benteng peninggalan Kerajaan Gowa ini nampaknya dipelihara dengan baik oleh pemerintah setempat..Iya, fokus pertama saya sesudah melewati gerbang pintu masuk adalah kebersihan areal benteng ini..Warna merah atap-atap bangunan menyala terang tidak kusam, trus juga sekeliling cukup bersih dari sampah plastik..Museum La Galigo memang kecil tetapi cukup informatif menjelaskan tentang kebudayaan dan sejarah Sulawesi Selatan dan beberapa daerah lainnya..Nilai plus dari benteng ini pada saat saya berkunjung adalah ada banyak pelajar dan mahasiswa yang belajar bersama di areal benteng ini.Semacam dijadikan tempat field trip atau juga tempat diskusi yang menyenangkan..","['benteng', 'tinggal', 'raja', 'gowa', 'nampaknya', 'pelihara', 'perintah', 'iya', 'fokus', 'gerbang', 'pintu', 'masuk', 'bersih', 'areal', 'benteng', 'warna', 'merah', 'atap', 'atap', 'bangun', 'nyala', 'terang', 'kusam', 'trus', 'keliling', 'bersih', 'sampah', 'plastik', 'museum', 'la', 'galigo', 'informatif', 'budaya', 'sejarah', 'sulawesi', 'selatan', 'daerah', 'nilai', 'plus', 'benteng', 'kunjung', 'ajar', 'mahasiswa', 'ajar', 'areal', 'benteng', 'field', 'trip', 'diskusi', 'senang']",benteng tinggal raja gowa nampaknya pelihara perintah iya fokus gerbang pintu masuk bersih areal benteng warna merah atap atap bangun nyala terang kusam trus keliling bersih sampah plastik museum la galigo informatif budaya sejarah sulawesi selatan daerah nilai plus benteng kunjung ajar mahasiswa ajar areal benteng field trip diskusi senang
