,Review_Text,Review_Clean_List,Review_Clean
348,"Benteng ini sebenarnya bagus karena juga berfungsi sebagai musium, di dalamnya kita bisa menyaksikan berbagai peninggalan masa lalu. Namun sayang banyak barang yang disimpan disana kurang terawat. Tempat yang luas dan terpisah dan tidak semua ada penjaga, jadi agak-agak ngeri kalau berjalan sendiri.","['benteng', 'bagus', 'fungsi', 'musium', 'saksi', 'tinggal', 'sayang', 'barang', 'simpan', 'awat', 'luas', 'pisah', 'jaga', 'ngeri', 'jalan']",benteng bagus fungsi musium saksi tinggal sayang barang simpan awat luas pisah jaga ngeri jalan
349,"Termasuk area wisata edukasi yang terawat dan value for maney. Area bersih, banyak spot untuk berfoto, disarankan untuk lokasi prewedding. Yang kurang dari tempat ini adalah keramahan petugas di museum. Serta koleksi dan penerangan museum yang seadanya, tdk sebanding dengan benteng secara keseluruhan, andai museumnya bisa sebaik museum gajah (nasional) dijakarta. Gedung yang kebanyakan di gunakan untuk perkantoran seolah tdk memenuhi dahaga wisatawan untuk menikmati tempat ini, disarankan gedung lain agar dijadikan galeri/ area pamer bukan hanya untuk barang kuno tapi juga seni kontemporer makasar.","['masuk', 'area', 'wisata', 'edukasi', 'awat', 'value', 'for', 'maney', 'area', 'bersih', 'spot', 'foto', 'saran', 'lokasi', 'prewedding', 'ramah', 'tugas', 'museum', 'koleksi', 'terang', 'museum', 'tdk', 'banding', 'benteng', 'andai', 'museum', 'museum', 'gajah', 'nasional', 'dijakarta', 'gedung', 'kantor', 'olah', 'tdk', 'penuh', 'dahaga', 'wisatawan', 'nikmat', 'saran', 'gedung', 'galeri', 'area', 'pamer', 'barang', 'kuno', 'seni', 'kontemporer', 'makasar']",masuk area wisata edukasi awat value for maney area bersih spot foto saran lokasi prewedding ramah tugas museum koleksi terang museum tdk banding benteng andai museum museum gajah nasional dijakarta gedung kantor olah tdk penuh dahaga wisatawan nikmat saran gedung galeri area pamer barang kuno seni kontemporer makasar
350,"bangunan zaman dahulu yang sangat terawat dan sangat indah..lokasi yang pas utk berfoto-foto, bangunan ini sangat kokoh dan keindahannya luar biasa..","['bangun', 'zaman', 'awat', 'indah', 'lokasi', 'pas', 'utk', 'foto', 'foto', 'bangun', 'kokoh', 'indah']",bangun zaman awat indah lokasi pas utk foto foto bangun kokoh indah
351,"Sebenarnya tempat ini menarik dan atraktif. Apalagi kalau ada event. Cuma kalau ada event, parkir kendaraan yang sulit. Areanya sempit dan beberapa spot malah tanpa juru parkir yang mengatur mobil. Tapi kalau mobil pergi keluar dari parkiran, e..e...si jukir tiba-tiba nongol dengan sempritan dan berlagak buka jalan. Pasca renovasi tahun 2014, menurut saya Roterdam makin tambah keceh. Lebih bersih dan terawat. Moga makin banyak event ya di tempat ini. Soalnya kalau enggak ada, layaknya berkunjung ke bangunan tua aja.","['tarik', 'atraktif', 'event', 'event', 'parkir', 'kendara', 'sulit', 'area', 'sempit', 'spot', 'juru', 'parkir', 'atur', 'mobil', 'mobil', 'pergi', 'parkir', 'e', 'e', 'si', 'jukir', 'nongol', 'semprit', 'lagak', 'buka', 'jalan', 'pasca', 'renovasi', 'roterdam', 'keceh', 'bersih', 'awat', 'moga', 'event', 'ya', 'layak', 'kunjung', 'bangun', 'tua', 'aja']",tarik atraktif event event parkir kendara sulit area sempit spot juru parkir atur mobil mobil pergi parkir e e si jukir nongol semprit lagak buka jalan pasca renovasi roterdam keceh bersih awat moga event ya layak kunjung bangun tua aja
352,Benteng Rotterdam yang terletak berdekatan dengan Pantai Losari sangat sayang jika dilewatkan jika anda tengah berlibur di Makassar. Siapapun diperbolehkan masuk ke benteng ini tanpa dipungut biaya. Ada pemandu jika anda berminat. Terdapat peninggalan masa Belanda disini yang tentunya dapat menambah ilmu pengetahuan anda.,"['benteng', 'rotterdam', 'letak', 'pantai', 'losari', 'sayang', 'libur', 'makassar', 'masuk', 'benteng', 'pungut', 'biaya', 'pandu', 'minat', 'tinggal', 'belanda', 'ilmu']",benteng rotterdam letak pantai losari sayang libur makassar masuk benteng pungut biaya pandu minat tinggal belanda ilmu
353,"Benteng ini menyimpan berbagai benda bersejarah dari mulai la galigo,pakaian adat,senjata khas,sampai peralatan dari zaman purba pun tersimpan disini.Jika anda ingin wisata sejarah lebih baik anda kesini","['benteng', 'simpan', 'benda', 'sejarah', 'la', 'galigo', 'pakai', 'adat', 'senjata', 'khas', 'alat', 'zaman', 'purba', 'simpan', 'wisata', 'sejarah', 'kesini']",benteng simpan benda sejarah la galigo pakai adat senjata khas alat zaman purba simpan wisata sejarah kesini
354,"Benteng ini tutup kalau malam, tapi disini kita bisa melihat bagaimana kokohnya pertahanan makassar dengan benteng ini yang dibangun belanda","['benteng', 'tutup', 'malam', 'lihat', 'kokoh', 'tahan', 'makassar', 'benteng', 'bangun', 'belanda']",benteng tutup malam lihat kokoh tahan makassar benteng bangun belanda
355,"Sayangnya karena keterbatasan waktu, pas datang kesini ga pake guide, hanya jalan-jalan dan melihat, sambil foto-foto.  Naik ke atas melewati jalan seperti terowongan kecil tak terbayang jaman dulu seperti apa. Tempat sangat terawat, hanya karena sekeliling sudah dipenuhi rumah-rumah. Semoga bisa kesini lagi dan lebih santai dan mendengar cerita sejarah, dan khususnya bisa masuk ke museum La Galigo","['sayang', 'batas', 'pas', 'kesini', 'ga', 'pake', 'guide', 'jalan', 'jalan', 'lihat', 'foto', 'foto', 'jalan', 'terowongan', 'bayang', 'jaman', 'awat', 'keliling', 'penuh', 'rumah', 'rumah', 'moga', 'kesini', 'santai', 'dengar', 'cerita', 'sejarah', 'khusus', 'masuk', 'museum', 'la', 'galigo']",sayang batas pas kesini ga pake guide jalan jalan lihat foto foto jalan terowongan bayang jaman awat keliling penuh rumah rumah moga kesini santai dengar cerita sejarah khusus masuk museum la galigo
356,Kadang salah satu kekurangan kita sbagai org Indo cmn dtg dan foto2 tapi ga dengerin penjelasan ttg bangunan tersebut. Tapi kali ini sy mau ada guide yang jelasin. Dan tercengang bgt membuka mata kalau kerajaan goa dan jga armada lautnya hebat di jamannya. Tapi sayang bangsa ini harus hancur krn devide et imperam  ,"['kadang', 'salah', 'sbagai', 'org', 'indo', 'cmn', 'dtg', 'foto', 'ga', 'dengerin', 'ttg', 'bangun', 'kali', 'sy', 'guide', 'jelasin', 'cengang', 'bgt', 'buka', 'mata', 'raja', 'goa', 'jga', 'armada', 'laut', 'hebat', 'jaman', 'sayang', 'bangsa', 'hancur', 'krn', 'devide', 'et', 'imperam']",kadang salah sbagai org indo cmn dtg foto ga dengerin ttg bangun kali sy guide jelasin cengang bgt buka mata raja goa jga armada laut hebat jaman sayang bangsa hancur krn devide et imperam
357,Datang ke setiap tempat pasti ingin datang ke tempat bersejarah atau museum. Di Makassar ada Benteng Rotterdam di Jl Penghibur Makassar yang patut untuk dikunjungi. Di tempat ini anda akan bisa  menikmati bangunan tua benteng ini dan bisa mengunjungi museum yang ada di dalamnya. Museum di Benteng Fort Rotterdam ini dinamakan Museum La Galigo. Museum ini merupakan museum yang berisi aneka peninggalan manusia dari zaman dahulu kala. Berbagai artefak dan pengetahuan tentang asal usul manusia bisa anda pelajari di dalam museum ini. Untuk masuk Benteng Rotterdam membayar sumbangan Rp 10.000 per orang dan masuk museum Rp 7.500 per orang ,"['sejarah', 'museum', 'makassar', 'benteng', 'rotterdam', 'jl', 'hibur', 'makassar', 'patut', 'kunjung', 'nikmat', 'bangun', 'tua', 'benteng', 'unjung', 'museum', 'museum', 'benteng', 'fort', 'rotterdam', 'nama', 'museum', 'la', 'galigo', 'museum', 'rupa', 'museum', 'isi', 'aneka', 'tinggal', 'manusia', 'zaman', 'artefak', 'usul', 'manusia', 'ajar', 'museum', 'masuk', 'benteng', 'rotterdam', 'bayar', 'sumbang', 'rp', 'orang', 'masuk', 'museum', 'rp', 'orang']",sejarah museum makassar benteng rotterdam jl hibur makassar patut kunjung nikmat bangun tua benteng unjung museum museum benteng fort rotterdam nama museum la galigo museum rupa museum isi aneka tinggal manusia zaman artefak usul manusia ajar museum masuk benteng rotterdam bayar sumbang rp orang masuk museum rp orang
358,Fort Rotterdam ini terletak di dekat pantai losari dan didepannya terdapat tempat makan yaitu Kampoe Popsa. Di Fort Rotterdam kita bisa melihat sejarah peninggalam belanda dan pahlawan-pahlaaan di makassar ,"['fort', 'rotterdam', 'letak', 'pantai', 'losari', 'makan', 'kampoe', 'popsa', 'fort', 'rotterdam', 'lihat', 'sejarah', 'peninggalam', 'belanda', 'pahlawan', 'pahlaaan', 'makassar']",fort rotterdam letak pantai losari makan kampoe popsa fort rotterdam lihat sejarah peninggalam belanda pahlawan pahlaaan makassar
359,"Tempat ini terkenal di makassar, benteng yang luas dengan museum di dalamnya. Akses masuk gratis, hanya parkir yang berbayar. Banyak tempat duduk sehingga kadang tempat ini dipakai beberapa komunitas untuk ngumpul. Keindahan taman terjaga dan bersih.","['kenal', 'makassar', 'benteng', 'luas', 'museum', 'akses', 'masuk', 'gratis', 'parkir', 'bayar', 'duduk', 'kadang', 'pakai', 'komunitas', 'ngumpul', 'indah', 'taman', 'jaga', 'bersih']",kenal makassar benteng luas museum akses masuk gratis parkir bayar duduk kadang pakai komunitas ngumpul indah taman jaga bersih
360,Benteng peninggalan Belanda ini merupakan salah satu tempat wisata yang patut dikunjungi bila ke Makassar. Areanya luas dan terawat juga terdapat museum didalam area benteng.,"['benteng', 'tinggal', 'belanda', 'rupa', 'salah', 'wisata', 'patut', 'kunjung', 'makassar', 'area', 'luas', 'awat', 'museum', 'area', 'benteng']",benteng tinggal belanda rupa salah wisata patut kunjung makassar area luas awat museum area benteng
361,"Sejarahnya yang panjang benteng ini, membuatnya menjadi tujuan penting buat para wisatawan. Taman di dalam benteng yang rapih menjadi backgroun foto yang cantik. ","['sejarah', 'benteng', 'tuju', 'wisatawan', 'taman', 'benteng', 'rapih', 'backgroun', 'foto', 'cantik']",sejarah benteng tuju wisatawan taman benteng rapih backgroun foto cantik
362,"pas masuk benteng ini agak ragu, itu kantor ato tempat wisata. ternyata bener dua-duanya. didalamnya ada beberapa bangunannya yang dijadikan kntor. jd kl masuk, feel nya kurang dapet, ga ada sentuhan sejarahnya,padahal ini kan bangunan bersejarah. yang menarik disini cuma dibagian atas tempat puing2 batu2, bisa liat pantai.","['pas', 'masuk', 'benteng', 'ragu', 'kantor', 'ato', 'wisata', 'nyata', 'bener', 'bangun', 'kntor', 'jd', 'kl', 'masuk', 'feel', 'nya', 'dapet', 'ga', 'sentuh', 'sejarah', 'bangun', 'sejarah', 'tarik', 'puing', 'batu', 'liat', 'pantai']",pas masuk benteng ragu kantor ato wisata nyata bener bangun kntor jd kl masuk feel nya dapet ga sentuh sejarah bangun sejarah tarik puing batu liat pantai
363,"fort rotterdam adalah salah satu benteng peninggalan belanda di makassar. salah satu yang menarik dari tempat ini adalah keberadaan museum didalamnya. museum ini memperlihatkan makassar secra keseluruhan, mulai adat istiadat hingga budaya2 khas yang hanya ada di sulawesi selatan. reccomended  ","['fort', 'rotterdam', 'salah', 'benteng', 'tinggal', 'belanda', 'makassar', 'salah', 'tarik', 'museum', 'museum', 'lihat', 'makassar', 'secra', 'adat', 'istiadat', 'budaya', 'khas', 'sulawesi', 'selatan', 'reccomended']",fort rotterdam salah benteng tinggal belanda makassar salah tarik museum museum lihat makassar secra adat istiadat budaya khas sulawesi selatan reccomended
364,"kesempatan ke makassar gk saya lewatkan untuj mampir kesini. Sungguh apik sekali benteng satu ini. bersih, view nya bagus krn lgsg ke selat makassar. Bpk bpk yg bertugas disini sangat ramah untuk menceritakan sejarah benteng ini. Kalo anda suka sejarah dan berkesempatan kesini. anda wajib kesini!","['makassar', 'gk', 'untuj', 'mampir', 'kesini', 'sungguh', 'apik', 'benteng', 'bersih', 'view', 'nya', 'bagus', 'krn', 'lgsg', 'selat', 'makassar', 'bpk', 'bpk', 'yg', 'tugas', 'ramah', 'cerita', 'sejarah', 'benteng', 'kalo', 'suka', 'sejarah', 'kesini', 'wajib', 'kesini']",makassar gk untuj mampir kesini sungguh apik benteng bersih view nya bagus krn lgsg selat makassar bpk bpk yg tugas ramah cerita sejarah benteng kalo suka sejarah kesini wajib kesini
365,"Dulu benteng ini bernama Benteng Jumpandang, namun diubah menjadi Fort Rotterdam ketika VOC menguasainya. Situs yang indah dan termasuk yang paling utuh di Indonesia!","['benteng', 'nama', 'benteng', 'jumpandang', 'ubah', 'fort', 'rotterdam', 'voc', 'kuasa', 'situs', 'indah', 'masuk', 'utuh', 'indonesia']",benteng nama benteng jumpandang ubah fort rotterdam voc kuasa situs indah masuk utuh indonesia
366,"Benteng Rotterdam sangat megah, namun sayangnya kurang terawat. Banyak coretan dan sampah di sekitar benteng. Kurang dilengkapi dengan pemandu wisata resmi maupun brosur informasi bagi wisatawan untuk menjelajah sendiri.","['benteng', 'rotterdam', 'megah', 'sayang', 'awat', 'coret', 'sampah', 'benteng', 'lengkap', 'pandu', 'wisata', 'resmi', 'brosur', 'informasi', 'wisatawan', 'jelajah']",benteng rotterdam megah sayang awat coret sampah benteng lengkap pandu wisata resmi brosur informasi wisatawan jelajah
367,Salah satu peninggalan raja Makasar yang kemudian dipakai oleh Belanda sebagai Benteng. terawat dengan baik dan menjadi salah satu favorit wisata di Makasar,"['salah', 'tinggal', 'raja', 'makasar', 'pakai', 'belanda', 'benteng', 'awat', 'salah', 'favorit', 'wisata', 'makasar']",salah tinggal raja makasar pakai belanda benteng awat salah favorit wisata makasar
368,Benteng ini cukup luas areanya dan berdiri dengan sangat gagah di tengah kota Makassar. Jika ke Makassar tak ada salahnya kesini karena lokasinya yang cukup dekat dengan Losari dan pusat oleh-oleh Sumba Opu.,"['benteng', 'luas', 'area', 'gagah', 'kota', 'makassar', 'makassar', 'salah', 'kesini', 'lokasi', 'losari', 'pusat', 'sumba', 'opu']",benteng luas area gagah kota makassar makassar salah kesini lokasi losari pusat sumba opu
369,"ke makasar sempatkan mampir ke benteng fort roterdam, museum ini lumayan terawat, bersih, rapi dan bersejarah","['makasar', 'mampir', 'benteng', 'fort', 'roterdam', 'museum', 'lumayan', 'awat', 'bersih', 'rapi', 'sejarah']",makasar mampir benteng fort roterdam museum lumayan awat bersih rapi sejarah
370,Fort Roterdam adalah lokasi destinasi pertama yang saya kunjungi di Makassar. kesan bangunan ini serasa tertanam di kepala saya sehingga mendorong saya untuk segera mengunjunginya. di dalam lokasi benteng saya mengelilingi setiap sudut benteng dan juga masuk ke musium lagaligo. museum yang berada di dalam benteng ini menyimpan koleksi barang bersejarah di makasar khususnya dan sulawesi selatan umumnya. tidak lupa saya juga menyempatkan melihat salah satu sudut beteng tempat Pangeran Diponegoro dahulu di tahan oleh penjajah belanda,"['fort', 'roterdam', 'lokasi', 'destinasi', 'kunjung', 'makassar', 'kesan', 'bangun', 'serasa', 'tanam', 'kepala', 'dorong', 'unjung', 'lokasi', 'benteng', 'keliling', 'sudut', 'benteng', 'masuk', 'musium', 'lagaligo', 'museum', 'benteng', 'simpan', 'koleksi', 'barang', 'sejarah', 'makasar', 'khusus', 'sulawesi', 'selatan', 'lupa', 'lihat', 'salah', 'sudut', 'beteng', 'pangeran', 'diponegoro', 'tahan', 'jajah', 'belanda']",fort roterdam lokasi destinasi kunjung makassar kesan bangun serasa tanam kepala dorong unjung lokasi benteng keliling sudut benteng masuk musium lagaligo museum benteng simpan koleksi barang sejarah makasar khusus sulawesi selatan lupa lihat salah sudut beteng pangeran diponegoro tahan jajah belanda
371,"Tempat wisata sejarah yang terletak di kota dan tak pernah sepi terutama saat weekend. Acara komunitas, festival kuliner, hingga reuni sering diadakan disini menggabungkan rasa sejarah dan rasa modern","['wisata', 'sejarah', 'letak', 'kota', 'sepi', 'utama', 'weekend', 'acara', 'komunitas', 'festival', 'kuliner', 'reuni', 'gabung', 'sejarah', 'modern']",wisata sejarah letak kota sepi utama weekend acara komunitas festival kuliner reuni gabung sejarah modern
372,"di kota makasar terdapat benteng rotterdam, terletak dekat dewan kawasan pantai losari dan dapat dicapai dengan berjalan kaki saja. di benteng ini terdapat musium dan bekas penjara salah satu pahlawan (saya lupa namanya, hehe)cukuplah untuk sekedar menambah koleksi poto-poto","['kota', 'makasar', 'benteng', 'rotterdam', 'letak', 'dewan', 'kawasan', 'pantai', 'losari', 'capai', 'jalan', 'kaki', 'benteng', 'musium', 'bekas', 'penjara', 'salah', 'pahlawan', 'lupa', 'nama', 'hehe', 'dar', 'koleksi', 'poto', 'poto']",kota makasar benteng rotterdam letak dewan kawasan pantai losari capai jalan kaki benteng musium bekas penjara salah pahlawan lupa nama hehe dar koleksi poto poto
373,Benteng bersejarah peninggalan Belanda ini luar biasa mengagumkan dan kurang seru jika ke makassar tak ke sini. Bangunannya masih sangat kokoh dengan area yang sangat luas. dekat juga dengan kampung popsa. perfect banget bisa berwisata dan belajar sejarah sekaligus di sini.,"['benteng', 'sejarah', 'tinggal', 'belanda', 'kagum', 'seru', 'makassar', 'bangun', 'kokoh', 'area', 'luas', 'kampung', 'popsa', 'perfect', 'banget', 'wisata', 'ajar', 'sejarah']",benteng sejarah tinggal belanda kagum seru makassar bangun kokoh area luas kampung popsa perfect banget wisata ajar sejarah
374,"Benteng belanda yg mengajarkan kita akan sejarah sulsel secara umum mulai dari zaman prasejarah sampai dengan perang kemerdekaan,biaya tiket yg murah hanya 5000 per orang untuk masul setiap situs. Perlu dijaga kelestarian dan keamanannya karena masih ada bekas vandalisme/coret2 di dinding luar benteng dari orgyg tdk bertanggung jawab","['benteng', 'belanda', 'yg', 'ajar', 'sejarah', 'sulsel', 'zaman', 'prasejarah', 'perang', 'merdeka', 'biaya', 'tiket', 'yg', 'murah', 'orang', 'masul', 'situs', 'jaga', 'lestari', 'aman', 'bekas', 'vandalisme', 'coret', 'dinding', 'benteng', 'orgyg', 'tdk', 'tanggung']",benteng belanda yg ajar sejarah sulsel zaman prasejarah perang merdeka biaya tiket yg murah orang masul situs jaga lestari aman bekas vandalisme coret dinding benteng orgyg tdk tanggung
375,"wisata murah, dekat dengan losari, bisa dijangkau dengan bis damri apabila menginap di bandara dan dekat dengan tempat makan yang murah :)","['wisata', 'murah', 'losari', 'jangkau', 'bis', 'damri', 'inap', 'bandara', 'makan', 'murah']",wisata murah losari jangkau bis damri inap bandara makan murah
376,"tempat ini merupakan objek sejarah yang sangat bagus untuk di kunjungi karena banyak hal-hal tentang sejarah penjajahan di informasikan di benteng roterdam, selain itu juga tersedia musium lagaligo yang memuat tentang kerajaan-kerajaan yang ada di sulawesi selatan. Tempat ini mudah di jangkau dan harganya juga sangat murah selain itu di sekitar objek wisata ini terdapat banyak tempat kuliner asli kota makassar","['rupa', 'objek', 'sejarah', 'bagus', 'kunjung', 'sejarah', 'jajah', 'informasi', 'benteng', 'roterdam', 'sedia', 'musium', 'lagaligo', 'muat', 'raja', 'raja', 'sulawesi', 'selatan', 'mudah', 'jangkau', 'harga', 'murah', 'objek', 'wisata', 'kuliner', 'asli', 'kota', 'makassar']",rupa objek sejarah bagus kunjung sejarah jajah informasi benteng roterdam sedia musium lagaligo muat raja raja sulawesi selatan mudah jangkau harga murah objek wisata kuliner asli kota makassar
377,"Model Arsitektur yang menyerupai Kura-kura membuat kita berpikir kenapa mesti begitu? namun dibalik dari rasa penasaran tersebut ternyata terjawab bahwa model tersebut adalah strategi pertahanan yang cukup kuat..dibagian bawah ternyata ada akses menuju langsung kelaut..namun sekarang itu sudah tertutup...dari atas tembok benteng kita bisa duduk atau berdiri sambil menunggu sunset..pengalaman yang luar biasa namun sayang karena depan benteng ada beberapa bangunan yang sangat mengganggu untuk menikmati tepi pantai yang indah tersebut..dibagian dalam ada sel tahanan bekas penjara pangeran diponegoro, ada juga museum bagi para penggemar sejarah...pokoknya benteng ini bisa direkomendasikan buat teman-teman yang berkunjung ke makassar, view yang ditampilkan bisa membimbing kita untuk mengeluarkan kamera sambil berselfie ria...","['model', 'arsitektur', 'rupa', 'kura', 'kura', 'pikir', 'mesti', 'penasaran', 'nyata', 'model', 'strategi', 'tahan', 'kuat', 'nyata', 'akses', 'tuju', 'langsung', 'laut', 'tutup', 'tembok', 'benteng', 'duduk', 'tunggu', 'sunset', 'alam', 'sayang', 'benteng', 'bangun', 'ganggu', 'nikmat', 'tepi', 'pantai', 'indah', 'sel', 'tahan', 'bekas', 'penjara', 'pangeran', 'diponegoro', 'museum', 'gemar', 'sejarah', 'pokok', 'benteng', 'rekomendasi', 'teman', 'teman', 'kunjung', 'makassar', 'view', 'tampil', 'bimbing', 'kamera', 'berselfie', 'ria']",model arsitektur rupa kura kura pikir mesti penasaran nyata model strategi tahan kuat nyata akses tuju langsung laut tutup tembok benteng duduk tunggu sunset alam sayang benteng bangun ganggu nikmat tepi pantai indah sel tahan bekas penjara pangeran diponegoro museum gemar sejarah pokok benteng rekomendasi teman teman kunjung makassar view tampil bimbing kamera berselfie ria
378,Benteng Roterdam Makasar tempat yang perlu dikunjungi. Tempat yang mudah dijangkau walau dengan kendaraan umum. Bisa belajar sejarah dengan ongkos yang murah tiket dibandrol 5 ribu. Tempat yang menarik untuk mengabdikan momen foto dengan gaya narsis sepuasnya...... sambil mengeksplor seluruh sudutnya. ,"['benteng', 'roterdam', 'makasar', 'kunjung', 'mudah', 'jangkau', 'kendara', 'ajar', 'sejarah', 'ongkos', 'murah', 'tiket', 'dibandrol', 'ribu', 'tarik', 'abdi', 'momen', 'foto', 'gaya', 'narsis', 'puas', 'mengeksplor', 'sudut']",benteng roterdam makasar kunjung mudah jangkau kendara ajar sejarah ongkos murah tiket dibandrol ribu tarik abdi momen foto gaya narsis puas mengeksplor sudut
379,Inilah benteng paling terkenal di makassar yang merupakan warisan dari zaman kolonial belanda. Setiap hari apalagi akhir pekan seperti saat ini sangat ramai dengan pertunjukan seni lokal Dan berbagai kegiatan yang menunjukkan ciri khas kota daeng ini,"['benteng', 'kenal', 'makassar', 'rupa', 'waris', 'zaman', 'kolonial', 'belanda', 'pekan', 'ramai', 'seni', 'lokal', 'giat', 'ciri', 'khas', 'kota', 'daeng']",benteng kenal makassar rupa waris zaman kolonial belanda pekan ramai seni lokal giat ciri khas kota daeng
380,setiap ke makassar saya tak pernah bosan mengunjui tempat ini. dan setiap kesini selalu merasakan seperti di masa lampau. bangunan yang khas dan lansekap yang unik. jangan lupa siapkan foto untuk mengabadikan setiap momen anda.,"['makassar', 'bosan', 'mengunjui', 'kesini', 'lampau', 'bangun', 'khas', 'lansekap', 'unik', 'lupa', 'foto', 'abadi', 'momen']",makassar bosan mengunjui kesini lampau bangun khas lansekap unik lupa foto abadi momen
381,"Begitu masuk ke dalam area Benteng Rotterdam saya merasa seperti kembali ke masa lalu. Bangunannya masih terjaga keasliannya, namun sayang masih banyak sekali minusnya, 1. begitu masuk gerbang tamu di wajibkan untuk melapor dan mengisi buku tamu dan dipungut sumbangan sukarela dan saya tau ini adalah pungutan ilegal, 2. Ada beberapa titik di dalam benteng yang membuat pengunjung prihatin dimana ada terdapat sebuah menara besi yang di bawahnya banyak sesajen dan sebuah makam yang tidak jelas informasinya.3. banyak gedung yang tidak terawat dengan baik, beberapa bagian pintu banyak yang lepas, area dalam gedung pameran yang gelap dan pengap.3. Tidak tersedianya papan peta denah keseluruhan detile benteng.","['masuk', 'area', 'benteng', 'rotterdam', 'bangun', 'jaga', 'asli', 'sayang', 'minus', 'masuk', 'gerbang', 'tamu', 'wajib', 'lapor', 'isi', 'buku', 'tamu', 'pungut', 'sumbang', 'sukarela', 'tau', 'pungut', 'ilegal', 'titik', 'benteng', 'unjung', 'prihatin', 'buah', 'menara', 'besi', 'sesajen', 'buah', 'makam', 'informasi', 'gedung', 'awat', 'pintu', 'lepas', 'area', 'gedung', 'pamer', 'gelap', 'pengap', 'sedia', 'papan', 'peta', 'denah', 'detile', 'benteng']",masuk area benteng rotterdam bangun jaga asli sayang minus masuk gerbang tamu wajib lapor isi buku tamu pungut sumbang sukarela tau pungut ilegal titik benteng unjung prihatin buah menara besi sesajen buah makam informasi gedung awat pintu lepas area gedung pamer gelap pengap sedia papan peta denah detile benteng
382,"museum sejarah yang menarik, bersih walaupun suda ada pemugaran, tp ttp masih sarat dengan bangunan hindia belanda","['museum', 'sejarah', 'tarik', 'bersih', 'suda', 'pugar', 'tp', 'ttp', 'sarat', 'bangun', 'hindia', 'belanda']",museum sejarah tarik bersih suda pugar tp ttp sarat bangun hindia belanda
383,Ini merupkan benteng peninggalan belanda. Disini kita dapat mempelajari sejarah tentang indonesia khususnya masyarakat bugis-Makasar melawan penjajah.,"['merupkan', 'benteng', 'tinggal', 'belanda', 'ajar', 'sejarah', 'indonesia', 'khusus', 'masyarakat', 'bugis', 'makasar', 'lawan', 'jajah']",merupkan benteng tinggal belanda ajar sejarah indonesia khusus masyarakat bugis makasar lawan jajah
384,"Benteng ini cukup terawat, dengan lokasi yang sangat bersih tapi yang disayangkan fasilitas parkir yang kurang di depan benteng","['benteng', 'awat', 'lokasi', 'bersih', 'sayang', 'fasilitas', 'parkir', 'benteng']",benteng awat lokasi bersih sayang fasilitas parkir benteng
