,Review_Text,Review_Clean_List,Review_Clean
175,"nemuin ini di Google, karena sebagai pecinta tempat bersejarah dan pecinta Museum selepas dar pantai Losari nyempettin ketempat ini. biaya mauk gratis sumbangan seikhlasnya saja. didalamnya terdapat lapangan luas berbentuk persegi dengan bangunan tua disekelilingnya. didalam kawasan ini ada Museum Laligo. dan untuk bentengnya sendiri tidak jauh dari pintu masuk, agak sedikit menanjak dan disitulah letak reruntuhan benteng dengan satu meriam ditengah tengahnya. di jalan rayanya sendiri sebenarnya ada tulisan Rotterdam berwarna merah yang eye catching..tapi sayang pengunjungnya hanya beberapa orang.","['nemuin', 'google', 'cinta', 'sejarah', 'cinta', 'museum', 'lepas', 'dar', 'pantai', 'losari', 'nyempettin', 'biaya', 'mauk', 'gratis', 'sumbang', 'ikhlas', 'lapang', 'luas', 'bentuk', 'persegi', 'bangun', 'tua', 'keliling', 'kawasan', 'museum', 'laligo', 'benteng', 'pintu', 'masuk', 'tanjak', 'situ', 'letak', 'runtuh', 'benteng', 'meriam', 'jalan', 'raya', 'tulis', 'rotterdam', 'warna', 'merah', 'eye', 'catching', 'sayang', 'unjung', 'orang']",nemuin google cinta sejarah cinta museum lepas dar pantai losari nyempettin biaya mauk gratis sumbang ikhlas lapang luas bentuk persegi bangun tua keliling kawasan museum laligo benteng pintu masuk tanjak situ letak runtuh benteng meriam jalan raya tulis rotterdam warna merah eye catching sayang unjung orang
176,"Benteng ini mudah dikunjungi karena berada di dekat Pantai Losari. Secara umum benteng ini tetap terawat dan terjaga kelestariannya.Museum ini merupakan saksi bisu tentang perjuangan Rakyat Makassar terhadap penjajahan Belanda dan juga saksi bisu perjalanan Pangeran Diponegoro dalam pembuangannya di Kota Makassar. Museum ini juga menyimpan beberapa peninggalan pusaka kerajaan yang pernah berjaya di Sulawesi Selatan dan Nusantara seperti Kerajaan Gowa. Sayangnya, kebersihannya kurang terjaga bila kita mengelilingi museum ini. Perlu pengawasan yang lebih untuk pengunjung serta manajemen dalam penggunaan area museum ini bagi masyarakat umum.","['benteng', 'mudah', 'kunjung', 'pantai', 'losari', 'benteng', 'awat', 'jaga', 'lestari', 'museum', 'rupa', 'saksi', 'bisu', 'juang', 'rakyat', 'makassar', 'hadap', 'jajah', 'belanda', 'saksi', 'bisu', 'jalan', 'pangeran', 'diponegoro', 'buang', 'kota', 'makassar', 'museum', 'simpan', 'tinggal', 'pusaka', 'raja', 'jaya', 'sulawesi', 'selatan', 'nusantara', 'raja', 'gowa', 'sayang', 'bersih', 'jaga', 'keliling', 'museum', 'awas', 'unjung', 'manajemen', 'area', 'museum', 'masyarakat']",benteng mudah kunjung pantai losari benteng awat jaga lestari museum rupa saksi bisu juang rakyat makassar hadap jajah belanda saksi bisu jalan pangeran diponegoro buang kota makassar museum simpan tinggal pusaka raja jaya sulawesi selatan nusantara raja gowa sayang bersih jaga keliling museum awas unjung manajemen area museum masyarakat
177,"Benteng rotterdam adalah tempat wisata peninggalan belanda yang ada di makassar, maka ini adalah sungguh sangat bersejarah, dan cukup kagumnya , lokasi ini sungguh bersih dan rapih","['benteng', 'rotterdam', 'wisata', 'tinggal', 'belanda', 'makassar', 'sungguh', 'sejarah', 'kagum', 'lokasi', 'sungguh', 'bersih', 'rapih']",benteng rotterdam wisata tinggal belanda makassar sungguh sejarah kagum lokasi sungguh bersih rapih
178,"Baiknya pas ksini mungkin qt pake pemandu aja.. mskipun agak rumayan bayar pemandunya, tp trbayarlah dgn smua yg di dapat.. sejarah2nya semua mereka ceritain, jd qt jg bs nanya2 n tau lbh banyak..","['pas', 'ksini', 'qt', 'pake', 'pandu', 'aja', 'mskipun', 'rumayan', 'bayar', 'pandu', 'tp', 'trbayarlah', 'dgn', 'smua', 'yg', 'sejarah', 'nya', 'ceritain', 'jd', 'qt', 'jg', 'bs', 'nanya', 'n', 'tau', 'lbh']",pas ksini qt pake pandu aja mskipun rumayan bayar pandu tp trbayarlah dgn smua yg sejarah nya ceritain jd qt jg bs nanya n tau lbh
179,"Bangunan classic yang cukup terkenal di kota makassar,di dalam lokasi terdapat berbagai museumCocok bagi anda yang pecinta sejarah","['bangun', 'classic', 'kenal', 'kota', 'makassar', 'lokasi', 'museumcocok', 'cinta', 'sejarah']",bangun classic kenal kota makassar lokasi museumcocok cinta sejarah
180,Tempatnya bagus. Cocok untuk wisatawan liar negeri. Dekat dari pantai losari. Tinggal jalan kaki saja selama 10 menit.,"['bagus', 'cocok', 'wisatawan', 'liar', 'negeri', 'pantai', 'losari', 'tinggal', 'jalan', 'kaki', 'menit']",bagus cocok wisatawan liar negeri pantai losari tinggal jalan kaki menit
181,"benteng rotterdam merupakan salah satu pusat peninggalan belanda. indah dan kokoh sekali ketika kita menginjakan kaki pertama masuk ke benteng ini. telusuri semua kawasan benteng dapat membuat kita belajar pentingnya sejarah, semoga tetap bersh. pas kesana pas banget lagi ada festival pertunjukan musik di dalmenya","['benteng', 'rotterdam', 'rupa', 'salah', 'pusat', 'tinggal', 'belanda', 'indah', 'kokoh', 'kinja', 'kaki', 'masuk', 'benteng', 'telusur', 'kawasan', 'benteng', 'ajar', 'sejarah', 'moga', 'bersh', 'pas', 'kesana', 'pas', 'banget', 'festival', 'musik', 'dalmenya']",benteng rotterdam rupa salah pusat tinggal belanda indah kokoh kinja kaki masuk benteng telusur kawasan benteng ajar sejarah moga bersh pas kesana pas banget festival musik dalmenya
182,Keren dan asik...suasana asri dan nyaman...cocok buat wisata edukasi dan wisata sejarah...tempatnya juga cocok buat pra wedding dgn suguhan vintage yang bikin suasana berasa balik kemasa silam...kereeennnn,"['keren', 'asik', 'suasana', 'asri', 'nyaman', 'cocok', 'wisata', 'edukasi', 'wisata', 'sejarah', 'cocok', 'pra', 'wedding', 'dgn', 'suguh', 'vintage', 'bikin', 'suasana', 'asa', 'silam', 'kereeennnn']",keren asik suasana asri nyaman cocok wisata edukasi wisata sejarah cocok pra wedding dgn suguh vintage bikin suasana asa silam kereeennnn
183,Bersama anak-anak berlibur jangan pernah lupa untuk mengenalkan sejarah dan budaya pada mereka. Dan tempat ini sangat tepat untuk mengenalkan tempat ditahannya Pangeran Diponegoro dan sejarah adat Sulawesi Selatan. Wisata yang murah dan bermanfaat. Sayang banyak coretan di nama benteng bagian depan,"['anak', 'anak', 'libur', 'lupa', 'kenal', 'sejarah', 'budaya', 'kenal', 'tahan', 'pangeran', 'diponegoro', 'sejarah', 'adat', 'sulawesi', 'selatan', 'wisata', 'murah', 'manfaat', 'sayang', 'coret', 'nama', 'benteng']",anak anak libur lupa kenal sejarah budaya kenal tahan pangeran diponegoro sejarah adat sulawesi selatan wisata murah manfaat sayang coret nama benteng
184,Benteng Rotterdam merupakan obyek wisata penting yang pantang dilewatkan kalo mengunjungi Makassar. Halamannya luas dipenuhi bangunan arsitektur gaya lama jaman Belanda. Genting merah bata dan dinding dinding tebal berwarna putih merupakan ciri khas benteng ini.,"['benteng', 'rotterdam', 'rupa', 'obyek', 'wisata', 'pantang', 'kalo', 'unjung', 'makassar', 'halaman', 'luas', 'penuh', 'bangun', 'arsitektur', 'gaya', 'jaman', 'belanda', 'genting', 'merah', 'bata', 'dinding', 'dinding', 'tebal', 'warna', 'putih', 'rupa', 'ciri', 'khas', 'benteng']",benteng rotterdam rupa obyek wisata pantang kalo unjung makassar halaman luas penuh bangun arsitektur gaya jaman belanda genting merah bata dinding dinding tebal warna putih rupa ciri khas benteng
185,"Kalau ke makassar jangan lupa berkunjung ke Benteng Rotterdam, letaknya berada di depan pantai, bangunannya unuk","['makassar', 'lupa', 'kunjung', 'benteng', 'rotterdam', 'letak', 'pantai', 'bangun', 'unuk']",makassar lupa kunjung benteng rotterdam letak pantai bangun unuk
186,"Bagus tempatnya, terawat, bersih, sayangnya menjadi tempat event-event yang seharusnya merupakan situs yang dilindungi, tolong dikurangi event-event untuk melestarikan situs ini","['bagus', 'awat', 'bersih', 'sayang', 'event', 'event', 'rupa', 'situs', 'lindung', 'tolong', 'rang', 'event', 'event', 'lestari', 'situs']",bagus awat bersih sayang event event rupa situs lindung tolong rang event event lestari situs
187,Benteng Rotterdam adalah salah satu gedung peninggalan belanda yang juga dijadikan museum.  Banyak menyimpan benda-benda bersejarah. Harus singgah kesini kalau ke Makassar,"['benteng', 'rotterdam', 'salah', 'gedung', 'tinggal', 'belanda', 'museum', 'simpan', 'benda', 'benda', 'sejarah', 'singgah', 'kesini', 'makassar']",benteng rotterdam salah gedung tinggal belanda museum simpan benda benda sejarah singgah kesini makassar
188,"Benteng ini merupakan tempat bersejarah,  dimana Belanda membangun  Benteng ini.  Banyak ruangan ruangan yg sekarang di pakai utk museum.  Harus di kunjungi jika datang ke makassar ","['benteng', 'rupa', 'sejarah', 'belanda', 'bangun', 'benteng', 'ruang', 'ruang', 'yg', 'pakai', 'utk', 'museum', 'kunjung', 'makassar']",benteng rupa sejarah belanda bangun benteng ruang ruang yg pakai utk museum kunjung makassar
189,"Benteng ini adalah benteng peninggalan kerajaan Gowa-Tallo yang terletak di tepi pantai Kota Makassar berarsitektur kolonial Belanda. Di benteng ini terdapat Museum La Galigo yang di dalamnya terdapat banyak referensi mengenai sejarah kebesaran Makassar (Gowa-Tallo) dan daerah-daerah lainnya yang ada di Sulawesi Selatan.Banyak spot foto yang cantik di tempat ini dan biasa digunakan untuk foto pra-wedding. Tempat ini sangat cocok dikunjungi pada sore hari menjelang malam, tapi jika ingin masuk ke museum datang pagi menjelang siang.","['benteng', 'benteng', 'tinggal', 'raja', 'gowa', 'tallo', 'letak', 'tepi', 'pantai', 'kota', 'makassar', 'arsitektur', 'kolonial', 'belanda', 'benteng', 'museum', 'la', 'galigo', 'referensi', 'kena', 'sejarah', 'makassar', 'gowa', 'tallo', 'daerah', 'daerah', 'sulawesi', 'selatan', 'spot', 'foto', 'cantik', 'foto', 'pra', 'wedding', 'cocok', 'kunjung', 'sore', 'jelang', 'malam', 'masuk', 'museum', 'pagi', 'jelang', 'siang']",benteng benteng tinggal raja gowa tallo letak tepi pantai kota makassar arsitektur kolonial belanda benteng museum la galigo referensi kena sejarah makassar gowa tallo daerah daerah sulawesi selatan spot foto cantik foto pra wedding cocok kunjung sore jelang malam masuk museum pagi jelang siang
190,Benteng Rotterdam adalah salah satu peninggalan bersejarah yang harus kita jaga dan kita lestarikan sebagai warisan budaya bangsa. Terletak disudut dekat pelabuhan dan tak jauh dari pantai losari... Disana ada tempat pengasingan pahlawan kita Pangeran Diponegoro. Yuk kita jalan jalan kesana...,"['benteng', 'rotterdam', 'salah', 'tinggal', 'sejarah', 'jaga', 'lestari', 'waris', 'budaya', 'bangsa', 'letak', 'sudut', 'labuh', 'pantai', 'losari', 'asing', 'pahlawan', 'pangeran', 'diponegoro', 'yuk', 'jalan', 'jalan', 'kesana']",benteng rotterdam salah tinggal sejarah jaga lestari waris budaya bangsa letak sudut labuh pantai losari asing pahlawan pangeran diponegoro yuk jalan jalan kesana
191,Saat ke Makassar sempatkan ke Benteng Rotterdam untuk mempelajari sejarah kota Makassar. Bagus juga untuk selfie.,"['makassar', 'benteng', 'rotterdam', 'ajar', 'sejarah', 'kota', 'makassar', 'bagus', 'selfie']",makassar benteng rotterdam ajar sejarah kota makassar bagus selfie
192,"Recomended banget ini tempat ,indah sekali berpergian dengan pasangan...Nuasa yang romantis,dan view disana sangat baik sekali.Wajib kesini kalau kalian berpergian ke kota makassar.Andai jakarta ada tempat seprti ini..","['recomended', 'banget', 'indah', 'pergi', 'pasang', 'nuasa', 'romantis', 'view', 'wajib', 'kesini', 'pergi', 'kota', 'makassar', 'andai', 'jakarta', 'seprti']",recomended banget indah pergi pasang nuasa romantis view wajib kesini pergi kota makassar andai jakarta seprti
193,"Untuk tempat wisata sejarah, tempat ini sangat direkomendasikan. Hanya saja pengunjung harus berhati2 saat ada orang yang mendekati dan menjelaskan tentang sejarah benteng ini, mereka adalah pemandu wisata yang memiliki tarif lumayan besar. Saat awal menjelaskan mereka tidak memperkenalkan diri sebagai pemandu wisata, hanya mengobrol seperti biasa. Saat di akhir percakapan mereka meminta imbalan. Apalagi untuk wisatawan asing harus berhati2 juga, imbalan yg diminta akan lebih besar.","['wisata', 'sejarah', 'rekomendasi', 'unjung', 'hati', 'orang', 'sejarah', 'benteng', 'pandu', 'wisata', 'milik', 'tarif', 'lumayan', 'kenal', 'pandu', 'wisata', 'obrol', 'cakap', 'imbal', 'wisatawan', 'asing', 'hati', 'imbal', 'yg']",wisata sejarah rekomendasi unjung hati orang sejarah benteng pandu wisata milik tarif lumayan kenal pandu wisata obrol cakap imbal wisatawan asing hati imbal yg
194,Banyak bangunan2 tua peninggalan belanda.. punya makna sejarah lengkap dengan benda2 peninggalan pada zaman itu,"['bangun', 'tua', 'tinggal', 'belanda', 'makna', 'sejarah', 'lengkap', 'benda', 'tinggal', 'zaman']",bangun tua tinggal belanda makna sejarah lengkap benda tinggal zaman
195,"Benteng Rotterdam salah satu benteng terbaik di Makassar, bentuknya sangat terawat dan rapi cocok untuk wisata edukasi. Di depan benteng ini terdapat pantai losari yang menjadi landmark kota Makassar, dan banyak terdapat lokasi kuliner disini","['benteng', 'rotterdam', 'salah', 'benteng', 'makassar', 'bentuk', 'awat', 'rapi', 'cocok', 'wisata', 'edukasi', 'benteng', 'pantai', 'losari', 'landmark', 'kota', 'makassar', 'lokasi', 'kuliner']",benteng rotterdam salah benteng makassar bentuk awat rapi cocok wisata edukasi benteng pantai losari landmark kota makassar lokasi kuliner
196,Gedung warisan zaman penjajahan Belanda yang masih berdiri kokoh ditengah kota Makasar. Cukup menambah indahnya kota Makasar. Mudah untuk di jangkau oleh semua orang termasuk semua wisatawan.,"['gedung', 'waris', 'zaman', 'jajah', 'belanda', 'kokoh', 'kota', 'makasar', 'indah', 'kota', 'makasar', 'mudah', 'jangkau', 'orang', 'masuk', 'wisatawan']",gedung waris zaman jajah belanda kokoh kota makasar indah kota makasar mudah jangkau orang masuk wisatawan
197,"Benteng Rotterdam adalah saksi peninggalan sejarah melawan penjajah dilokasi ini Anda dapat melihat sisa-sisa peperangan kerajaan gowa dalam mengusir penjajah dari tanah sulawesi, Benteng ini sangat wajib Anda kunjungi jika datang ke kota makassar.","['benteng', 'rotterdam', 'saksi', 'tinggal', 'sejarah', 'lawan', 'jajah', 'lokasi', 'lihat', 'sisa', 'sisa', 'peperangan', 'raja', 'gowa', 'usir', 'jajah', 'tanah', 'sulawesi', 'benteng', 'wajib', 'kunjung', 'kota', 'makassar']",benteng rotterdam saksi tinggal sejarah lawan jajah lokasi lihat sisa sisa peperangan raja gowa usir jajah tanah sulawesi benteng wajib kunjung kota makassar
198,"benteng rotterdam, lokasi yang sangat terkenal bagi daerah kota Makassar. disini hal-hal bersejarah terkumpul","['benteng', 'rotterdam', 'lokasi', 'kenal', 'daerah', 'kota', 'makassar', 'sejarah', 'kumpul']",benteng rotterdam lokasi kenal daerah kota makassar sejarah kumpul
199,Namanya ini yg membuat orang penasaran dan berfoto2 disini... Berasa berada di negeri kincir angin namanya belanda banget. Tapi ya itulah sejarah disini yg berasa banget ketika melihat bekas reruntuhan yg ada... Jangan lupa tuk berfoto2 di bangunan jaman Belanda dulu...,"['nama', 'yg', 'orang', 'penasaran', 'foto', 'asa', 'negeri', 'kincir', 'angin', 'nama', 'belanda', 'banget', 'ya', 'sejarah', 'yg', 'asa', 'banget', 'lihat', 'bekas', 'runtuh', 'yg', 'lupa', 'tuk', 'foto', 'bangun', 'jaman', 'belanda']",nama yg orang penasaran foto asa negeri kincir angin nama belanda banget ya sejarah yg asa banget lihat bekas runtuh yg lupa tuk foto bangun jaman belanda
200,"Bentengnya bersih dan terawat. Tidak banyak yang bisa dilakukan didalam, hanya melihat-lihat sejarah kuno, jika ingin kunjungan, kunjungan singkat pun cukup, satu jam untuk melihat lihat dan berfoto ria.  Lokasinya di utara pantai Losari, dapat dicapai dengan transportasi umum. Untuk masuk ke dalam benteng, kita tidak dipungut biaya apapun alias gratisss... Hanya diminta mengisi buku tamu pengunjung di pos depan benteng. ","['benteng', 'bersih', 'awat', 'laku', 'lihat', 'lihat', 'sejarah', 'kuno', 'kunjung', 'kunjung', 'singkat', 'jam', 'lihat', 'lihat', 'foto', 'ria', 'lokasi', 'utara', 'pantai', 'losari', 'capai', 'transportasi', 'masuk', 'benteng', 'pungut', 'biaya', 'alias', 'gratisss', 'isi', 'buku', 'tamu', 'unjung', 'pos', 'benteng']",benteng bersih awat laku lihat lihat sejarah kuno kunjung kunjung singkat jam lihat lihat foto ria lokasi utara pantai losari capai transportasi masuk benteng pungut biaya alias gratisss isi buku tamu unjung pos benteng
201,"Salah satu tempat yang katanya ""belum ke-Makassar sebelum ke benteng Rotterdam"". Merupakan salah satu destinasi wisata sejarah dimana kita bisa melihat benda benda peninggalan kerajaan Gowa dalam museum lagaligo, benda benda peninggalan perang seperti meriam, bangunan bergaya arsitektur Belanda (karena memang ini adalah situs peninggalan Belanda) dan batu batu yang tersusun menjadi benteng tentu saja.Tempat ini menjadi istimewa karena selain berwisata sejarah dan sekedar berfoto ria, ditempat ini kita bisa langsung melihat pantai Losari yang sangat terkenal di Makassar.Cek juga jadwal kedatangan / kunjungan Anda karena ditempat ini sering diadakan berbagai event seperti pertunjukan musik, bazar makanan, pameran, kegiatan sosial dll.If you are interested to come here, i'll be so happy to be your travel mate.Salam traveller! Ayo ke Makassar!!","['salah', 'makassar', 'benteng', 'rotterdam', 'rupa', 'salah', 'destinasi', 'wisata', 'sejarah', 'lihat', 'benda', 'benda', 'tinggal', 'raja', 'gowa', 'museum', 'lagaligo', 'benda', 'benda', 'tinggal', 'perang', 'meriam', 'bangun', 'gaya', 'arsitektur', 'belanda', 'situs', 'tinggal', 'belanda', 'batu', 'batu', 'susun', 'benteng', 'istimewa', 'wisata', 'sejarah', 'dar', 'foto', 'ria', 'langsung', 'lihat', 'pantai', 'losari', 'kenal', 'makassar', 'cek', 'jadwal', 'kunjung', 'event', 'musik', 'bazar', 'makan', 'pamer', 'giat', 'sosial', 'dll', 'if', 'you', 'are', 'interested', 'to', 'come', 'here', 'i', 'll', 'be', 'so', 'happy', 'to', 'be', 'your', 'travel', 'mate', 'salam', 'traveller', 'ayo', 'makassar']",salah makassar benteng rotterdam rupa salah destinasi wisata sejarah lihat benda benda tinggal raja gowa museum lagaligo benda benda tinggal perang meriam bangun gaya arsitektur belanda situs tinggal belanda batu batu susun benteng istimewa wisata sejarah dar foto ria langsung lihat pantai losari kenal makassar cek jadwal kunjung event musik bazar makan pamer giat sosial dll if you are interested to come here i ll be so happy to be your travel mate salam traveller ayo makassar
202,"Bentneg Rotterdam cocok banget bagi orang yang mau wisata sejarah. Didalamnya terdapat Museum Lagaligo dan beberapa barang peninggalan sejarah lainnya. Selain itu, bangunan dan arsitektur benteng ini juga unik. Yang mau sekedar bersantai bareng teman juga bisa di tempat ini.","['bentneg', 'rotterdam', 'cocok', 'banget', 'orang', 'wisata', 'sejarah', 'museum', 'lagaligo', 'barang', 'tinggal', 'sejarah', 'bangun', 'arsitektur', 'benteng', 'unik', 'dar', 'santa', 'bareng', 'teman']",bentneg rotterdam cocok banget orang wisata sejarah museum lagaligo barang tinggal sejarah bangun arsitektur benteng unik dar santa bareng teman
203,Sejarah makassar dari awal peradaban sampai modern tersedia disini. Bangunannya cukup bagus dan terawat. Ada juga toko suvenir dan dekat dengan pantai losari,"['sejarah', 'makassar', 'adab', 'modern', 'sedia', 'bangun', 'bagus', 'awat', 'toko', 'suvenir', 'pantai', 'losari']",sejarah makassar adab modern sedia bangun bagus awat toko suvenir pantai losari
204,"Berjalan ke pantai Losari jangan lupa mengunjungi tempat wisata sejarah berupa benteng Rotterdam peninggalan penjajahan Belanda. Di Benteng ini kita bisa merasakan bagaimana dahulu pahlawan dan juga Kakek Nenek kita melawan penjajah. Di dalam benteng masih tersimpan kenangan mengenai adanya penjajahan di negeri kita. Bangunan tampak terurus dan bersih. Walaupun beberapa orang bisa merasakan aura mistis tetapi keindahan benteng lebih mempesona untuk dikunjungi. Atau jika anda hanya ingin berfoto di depan benteng ini, juga sangat memuaskan hati bagi yang suka berfoto-foto.","['jalan', 'pantai', 'losari', 'lupa', 'unjung', 'wisata', 'sejarah', 'upa', 'benteng', 'rotterdam', 'tinggal', 'jajah', 'belanda', 'benteng', 'pahlawan', 'kakek', 'nenek', 'lawan', 'jajah', 'benteng', 'simpan', 'kenang', 'kena', 'jajah', 'negeri', 'bangun', 'urus', 'bersih', 'orang', 'aura', 'mistis', 'indah', 'benteng', 'pesona', 'kunjung', 'foto', 'benteng', 'muas', 'hati', 'suka', 'foto', 'foto']",jalan pantai losari lupa unjung wisata sejarah upa benteng rotterdam tinggal jajah belanda benteng pahlawan kakek nenek lawan jajah benteng simpan kenang kena jajah negeri bangun urus bersih orang aura mistis indah benteng pesona kunjung foto benteng muas hati suka foto foto
205,"Di sini adalah tempat yang cocok buat belajar sejarah, untuk biaya masuknya sendiri sebenarnya gratis tapi yah sekali buat sumbangan bolehlah mulai 5rb/10rb  rupiah terserah seikhlasnya tapi ini bukan hitungan perorang loh tapi rombongan jd dapat pengetahuan dan jalan2 yang murahkan, ada tourguest nya juga loh yah kalo ini mah tergantung negosiasi aja, untuk masuk lagi ke dalam museumnya yah adalah sedik bayar lagi gak nyampelah 20rban, jangan khawatir utk makanan banyak penjual dipinggir jalan","['cocok', 'ajar', 'sejarah', 'biaya', 'masuk', 'gratis', 'yah', 'sumbang', 'rb', 'rb', 'rupiah', 'serah', 'ikhlas', 'hitung', 'orang', 'loh', 'rombong', 'jd', 'jalan', 'murah', 'tourguest', 'nya', 'loh', 'yah', 'kalo', 'mah', 'gantung', 'negosiasi', 'aja', 'masuk', 'museum', 'yah', 'dik', 'bayar', 'gak', 'nyampelah', 'rban', 'khawatir', 'utk', 'makan', 'jual', 'pinggir', 'jalan']",cocok ajar sejarah biaya masuk gratis yah sumbang rb rb rupiah serah ikhlas hitung orang loh rombong jd jalan murah tourguest nya loh yah kalo mah gantung negosiasi aja masuk museum yah dik bayar gak nyampelah rban khawatir utk makan jual pinggir jalan
206,"Masuk ke Fort Rotterdam itu gratis, karenanya tempat ini jadi ramai sekali oleh pengunjung padahal saya kesana saat hari kerja.Bangunan sangat terjaga sekali keindahannya. Warna kuning benteng dan latar belakang langit biru sangat indah sekali jika ditangkap oleh lensa kamera. Naik ke bagian atas benteng untuk dapat view yang lebih baik.Kebersihan lokasi sekitar juga diperhatikan, saya tidak melihat ada sampah yang tergeletak sembarangan.Jangan lupa pakai topi kalau kesini, dan baju yang bagus !","['masuk', 'fort', 'rotterdam', 'gratis', 'ramai', 'unjung', 'kesana', 'kerja', 'bangun', 'jaga', 'indah', 'warna', 'kuning', 'benteng', 'latar', 'langit', 'biru', 'indah', 'tangkap', 'lensa', 'kamera', 'benteng', 'view', 'bersih', 'lokasi', 'perhati', 'lihat', 'sampah', 'geletak', 'sembarang', 'lupa', 'pakai', 'topi', 'kesini', 'baju', 'bagus']",masuk fort rotterdam gratis ramai unjung kesana kerja bangun jaga indah warna kuning benteng latar langit biru indah tangkap lensa kamera benteng view bersih lokasi perhati lihat sampah geletak sembarang lupa pakai topi kesini baju bagus
207,"terakhir ke sini bulan nov 2015. waktu itu jln2 sama pacar.. kirain cm jalan2 biasa,, g taunya malah dilamar di sana.. hahhaha.. sejarah banget di hidupku... untuk pengunjung, enaknya ke sini pas jam 4 sore sampe magrib.. bisa liat sunset.. suasana nya romantiss","['nov', 'jln', 'pacar', 'kirain', 'cm', 'jalan', 'g', 'tau', 'lamar', 'hahhaha', 'sejarah', 'banget', 'hidup', 'unjung', 'enak', 'pas', 'jam', 'sore', 'sampe', 'magrib', 'liat', 'sunset', 'suasana', 'nya', 'romantiss']",nov jln pacar kirain cm jalan g tau lamar hahhaha sejarah banget hidup unjung enak pas jam sore sampe magrib liat sunset suasana nya romantiss
208,"Salah satu tempat untuk wisata sejarah di Makassar. Selain seni arsitekturnya, di benteng rotterdam terdapat museum La Galigo tempat menyimpan beberapa benda bersejarah kota Makassar. Waktu terbaik mengunjungi benteng rotterdam adalah sore hari menjelang matahari terbenam sambil duduk di atas pagar benteng menanti datangnya sunset.Merupakan destinasi sejarah peninggalan belanda, dengan adanya bangunan bangunan yang bergaya kolonial belanda, selain itu, disini ada museum i laga ligo... dapat mempelajari asal usul, artefak dan peristiwa di sulsel dan di nusantara","['salah', 'wisata', 'sejarah', 'makassar', 'seni', 'arsitektur', 'benteng', 'rotterdam', 'museum', 'la', 'galigo', 'simpan', 'benda', 'sejarah', 'kota', 'makassar', 'unjung', 'benteng', 'rotterdam', 'sore', 'jelang', 'matahari', 'benam', 'duduk', 'pagar', 'benteng', 'sunset', 'rupa', 'destinasi', 'sejarah', 'tinggal', 'belanda', 'bangun', 'bangun', 'gaya', 'kolonial', 'belanda', 'museum', 'i', 'laga', 'ligo', 'ajar', 'usul', 'artefak', 'peristiwa', 'sulsel', 'nusantara']",salah wisata sejarah makassar seni arsitektur benteng rotterdam museum la galigo simpan benda sejarah kota makassar unjung benteng rotterdam sore jelang matahari benam duduk pagar benteng sunset rupa destinasi sejarah tinggal belanda bangun bangun gaya kolonial belanda museum i laga ligo ajar usul artefak peristiwa sulsel nusantara
